id,jugend,titel,inhalt,coaching
1,D-Jugend,Jäger und Gejagte (Aufwärmen),Feld 20x20m. Alle Spieler dribbeln frei. 2 Jäger versuchen Bälle wegzuspitzeln. Wer den Ball verliert wird selbst zum Jäger.,Blick weg vom Ball! Tempoänderungen nutzen um Jägern zu entkommen.
2,D-Jugend,Pass-Diamant (Technik),Aufbau eines Diamanten (10m Kantenlänge). Passfolge: A zu B -> B lässt klatschen -> A spielt tief auf C.,Präzision vor Tempo! Den ersten Kontakt direkt in die neue Spielrichtung mitnehmen.
3,D-Jugend,4 gegen 4 auf 4 Tore (Umschalten),Spielfeld 30x25m mit 2 Minitoren auf jeder Grundlinie. Tore zählen nur bei Abschluss innerhalb von 8 Sek. nach Ballgewinn.,Sofortiger Blick in die Tiefe nach Balleroberung. Spiel verlagern wenn eine Seite zu ist.
4,D-Jugend,Linien-Dribbler (Zweikampf),1 gegen 1 auf einer schmalen Zone (8m breit). Ziel: Über die gegnerische Grundlinie dribbeln.,Mut zum 1-gegen-1! Tempo aufnehmen und den Gegner mit einer Finte verladen.
5,D-Jugend,Abschluss-Wettkampf (Torschuss),Zwei Schlangen an der Strafraumgrenze. Pass vom Trainer -> Erster Kontakt -> Sofortiger Abschluss.,Konzentration beim Standbein! Den Ball mit dem Spann kontrolliert in die Ecken drücken.
